 
"Venezuela's injured activists struggle to heal CARACAS (Reuters) - Jesus Ibarra, a 19-year-old engineering student, has been barely able to walk or talk since a tear gas canister crushed part of his skull during a protest against President Nicolas Maduro and he fell unconscious into a river that carries sewage.  Chronic shortages of medicine in Venezuela forced his family to ask for drug donations so Ibarra could undergo five surgeries on his skull and treatment for infections from the Guaire river.  Ibarra, who cannot return to his studies any time soon, needs to a sixth operation and therapy. It is unclear if he will fully recover.   I speak to my son a lot, and sometimes he makes me understand it was not worth suffering this, that he regrets it, that it was a mistake,  said Ibarra s father Jose at their small home in the sprawling hilltop slum of Petare in Caracas.   But other times he s clearly telling me that it was worth fighting for a change he believes in.       Ibarra is one of nearly 2,000 people injured during four months of fierce anti-Maduro street protests, according to the public prosecutor s office. Rights groups think the number is probably higher.  Venezuela has been torn by political and economic crises that have led to extreme shortages of food and medicine, crushing inflation and the collapse of the local currency. Its    new government structure has been criticized as a dictatorship. Rubber bullets fired at close range, rocks, and tear gas canisters have caused most of the injuries, doctors and rights groups say. Most of those who have been hurt appear to be opposition protesters, but Maduro supporters, security forces and bystanders have also been harmed.     More than 125 people have died in the unrest since April.  Thousands have been arrested.  The unpopular leftist president has said he was facing an armed insurgency intent on overthrowing him.  Opposition politicians have said they were forced to take to the streets after authorities curtailed democratic means for change. They have also accused security forces of using excessive force against protesters. Culinary student Brian Dalati, 22, said he was passing an opposition-manned street barricade on his way to classes in July when police mistook him for a protester. They hit him and fired buckshot at his legs, fracturing both of Dalati s shinbones.  I depend on my siblings to go to the bathroom, shower, brush my teeth, eat, anything. It s infuriating,  he said.  They didn t have to do this. It was pure hate. Thank goodness I will be able to walk again soon.  The government says right-wing media are too focused on injuries to protesters.  Maduro has pointed to a case in which a 21-year-old man was set afire during an opposition protest and died two weeks later. A Reuters witness said the crowd had accused the man of being a thief, but the government said he was targeted for being a Maduro supporter. Protests have subsided since Maduro s government established a controversial legislative superbody three weeks ago, but hundreds of Venezuelans are still struggling to nurse their wounds without medicine and state support.   (Click on reut.rs/2xt4eoS for related photo essay)"
"India's push to broaden use of its biometric database (Reuters) - India s Supreme Court ruled on Thursday the right to privacy is a fundamental right protected by the Indian Constitution, in a potential setback to the government s push to mandate the use of Aadhaar, or unique ID numbers for a variety of routine tasks.   Over a billion Indians have already registered for Aadhaar cards, which ascribe unique ID numbers, and record fingerprints and iris scans of each person. The database was originally set-up to streamline welfare benefit payments and reduce wastage. The current government however, has been keen to mandate the use of Aadhaar for everything from the filing of income taxes to the operating of one s bank accounts. Below is a timeline on the various Aadhaar developments:  March 2006: India s Ministry of Communications and Information Technology approves a Unique ID (UID) scheme for poor families. December 2006: Empowered Group of Ministers (EGoM) constituted to collate two schemes -the National Population Register under the Citizenship Act, 1955 and the UID scheme. 2007: At its first meeting, the EGoM recognizes need to create a residents database. This leads to the creation of Aadhaar. 2009: The Unique Identification Authority of India (UIDAI) is created to issue unique identification numbers. Nandan Nilekani appointed the first chairman. December 2010: The National Identification Authority of India Bill, 2010 (NIAI Bill) introduced in Parliament. September 2011: Number of Aadhaar holders crosses 100 million.  December 2011: Standing committee on Finance rejects NIAI Bill in initial form; recommends requirement of privacy legislation and data protection law before continuance of scheme. 2012: Former High Court judge files petition contending that Aadhaar violates fundamental rights of equality and privacy. September 2013: Supreme Court passes interim order stating no person should suffer for not having an Aadhaar card.  December 2013: The number of Aadhaar holders crosses 510 million  March 2014: The Supreme Court revokes orders made by agencies demanding Aadhaar for welfare schemes. Court also forbids UIDAI from sharing information in the Aadhaar database with any agency without the individual s consent. December 2014: Number of Aadhaar holders crosses 720 million.     August 2015: Three-judge bench of Supreme Court limits use of Aadhaar to certain welfare schemes, orders that no one should be denied benefits for lack of an Aadhaar card. It refers question of right to privacy as a fundamental right to a constitution bench. February 2016: Number of Aadhaar holders crosses 980 million.   March 2016: Aadhaar (Targeted Delivery of Financial & Other Subsidies, Benefits & Services) Bill introduced as a money bill in the lower house of parliament. Bill passed by Parliament; receives presidential assent. January-March 2017: Various ministries make Aadhaar mandatory for welfare, pension, and employment schemes. Aadhaar made mandatory for filing of income tax returns. Aadhaar holders crosses 1.14 billion.  [Data compiled from Software Freedom Law Centre and State of Aadhaar Report 2016-17]"
"Finnish police release one knife attack suspect HELSINKI (Reuters) - Finnish police on Thursday released one of six men detained over last week s stabbing spree that killed two women and wounded eight other people in the city of Turku. The main suspect, who is in custody, has been named as Abderrahman Mechkah, an 18-year-old Moroccan. He told a court he was responsible for the attack but denied his motive was terrorism. At the time of the attack, Mechkah was appealing against a decision on his application for asylum, which apparently was denied. The released man was arrested on Wednesday along with another suspect, who remains in police custody. Friday s stabbings in the city of Turku have been treated as the first suspected Islamist militant attack in Finland, which boasts one of the lowest crime rates in the world."
"As Syria war tightens, U.S. and Russia military hotlines humming AL UDEID AIR BASE, Qatar (Reuters) - Even as tensions between the United States and Russia fester, there is one surprising place where their military-to-military contacts are quietly weathering the storm: Syria. It has been four months since U.S. President Donald Trump ordered cruise missile strikes against a Syrian airfield after an alleged chemical weapons attack.  In June, the U.S. military shot down a Syrian fighter aircraft, the first U.S. downing of a manned jet since 1999, and also shot down two Iranian-made drones that threatened U.S.-led coalition forces.   All the while, U.S. and Russian military officials have been regularly communicating, U.S. officials told Reuters. Some of the contacts are helping draw a line on the map that separates U.S.- and Russian-backed forces waging parallel campaigns on Syria s shrinking battlefields. There is also a telephone hotline linking the former Cold War foes  air operations centers. U.S. officials told Reuters that there now are about 10 to 12 calls a day on the hotline, helping keep U.S. and Russian warplanes apart as they support different fighters on the ground. That is no small task, given the complexities of Syria s civil war. Moscow backs the Syrian government, which also is aided by Iran and Lebanon s Hezbollah as it claws back territory from Syrian rebels and Islamic State fighters. The U.S. military is backing a collection of Kurdish and Arab forces focusing their firepower against Islamic State, part of a strategy to collapse the group s self-declared  caliphate  in Syria and Iraq. Reuters was given rare access to the U.S. Air Force s hotline station, inside the Qatar-based Combined Air Operations Area, last week, including meeting two Russian linguists, both native speakers, who serve as the U.S. interface for conversations with Russian commanders.   While the conversations are not easy, contacts between the two sides have remained resilient, senior U.S. commanders said.  The reality is we ve worked through some very hard problems and, in general, we have found a way to maintain the deconfliction line (that separates U.S. and Russian areas of operation) and found a way to continue our mission,  Lieutenant General Jeffrey Harrigian, the top U.S. Air Force commander in the Middle East, said in an interview.  As both sides scramble to capture what is left of Islamic State s caliphate, the risk of accidental contacts is growing.  We have to negotiate, and sometimes the phone calls are tense. Because for us, this is about protecting ourselves, our coalition partners and destroying the enemy,  Harrigian said, without commenting on the volume of calls. The risks of miscalculation came into full view in June, when the United States shot down a Syrian Su-22 jet that was preparing to fire on U.S.-backed forces on the ground.  U.S. officials, speaking on condition of anonymity, said  those were not the only aircraft in the area. As the incident unfolded, two Russian fighter jets looked on from above and a American F-22 stealth aircraft kept watch from an even higher altitude, they told Reuters. After the incident, Moscow publicly warned it would consider any planes flying west of the Euphrates River to be targets. But the U.S. military kept flying in the area, and kept talking with Russia.  The Russians have been nothing but professional, cordial and disciplined,  Army Lieutenant General Stephen Townsend, the Iraq-based commander of the U.S.-led coalition, told Reuters. In Syria, U.S.-backed forces are now consumed with the battle to capture Islamic State s former capital of Raqqa. More than half the city has been retaken from Islamic State. Officials said talks were underway to extend a demarcation line that has been separating U.S.- and Russian-backed fighters on the ground as fighting pushes toward Islamic State s last major Syrian stronghold, the Deir al-Zor region. The line runs in an irregular arc from a point southwest of Tabqa east to a point on the Euphrates River and then down along the Euphrates River in the direction of Deir al-Zor, they said. U.S. Defense Secretary Jim Mattis, during a visit to Jordan this week, said the line was important as U.S.- and Russian-backed forces come in closer proximity of each other.  We do not do that (communication) with the (Syrian) regime. It is with the Russians, is who we re dealing with,  Mattis said.  We continue those procedures right on down the Euphrates River Valley.  Bisected by the Euphrates River, Deir al-Zor and its oil resources are critical to the Syrian state.  The province is largely in the hands of Islamic State, but has become a priority for pro-Syrian forces. It also is in the crosshairs of the U.S.-backed Syrian Democratic Forces (SDF). SDF spokesman Talal Silo told Reuters last week that there would be an SDF campaign toward Deir al-Zor  in the near future,  though the SDF was still deciding whether it would be delayed until Raqqa was fully taken from Islamic State."
"U.N. calls for pause in air strikes to spare civilians in Syria's Raqqa GENEVA (Reuters) - The United Nations called on Thursday for a humanitarian pause to allow an estimated 20,000 trapped civilians to escape from the Syrian city of Raqqa, and urged the U.S.-led coalition to rein in air strikes that have caused casualties. Amnesty International said on Thursday that a U.S.-led coalition campaign to oust Islamic State from Raqqa had killed hundreds of civilians, and those remaining face greater risk as the fight intensifies in its final stages.   On Raqqa, our urging today from the UN side to the members of the humanitarian task force ... is that they need to do whatever is possible to make it possible for people to escape Raqqa,  Jan Egeland, U.N. humanitarian adviser on Syria, told reporters in Geneva.  Boats on the Euphrates must not be attacked, people who come out cannot risk air raids when and where they come out,  he said.  Now is the time to think of possibilities, pauses or otherwise that might facilitate the escape of civilians, knowing that Islamic State fighters are doing their absolute best to use them as human shields,  he said. Humanitarian pauses were agreed between the warring sides last December to allow the evacuation of civilians from then rebel-held eastern Aleppo, Egeland said. But he added that the United Nations has no contact with Islamic State fighters who have controlled Raqqa since 2014. Egeland, referring to U.S-backed Syrian Democratic Forces (SDF), said:  There is heavy shelling from the surrounding and encircling SDF forces and there are constant air raids from the coalition. So the civilian casualties are large and there seems to be no real escape for these civilians.  Syrian government forces, backed by the Russian air force and Iran-backed militias, have also been advancing against IS south of the River Euphrates that forms Raqqa city s southern edge.  Inside Raqqa city, on both sides, conditions are very bleak and it is very hard to assist in all areas,  Egeland said. The United Nations is still assessing the outcome of talks held this week in Riyadh between the three Syrian opposition groups - who failed to unite - Ramzy Ezzeldin Ramzy, the U.N. deputy special envoy for Syria, said.  Asked whether Syria peace talks would be held in Geneva in September, he said:  We are waiting to get a full picture as to what happened in Riyadh, and we will have further consultations with the interested parties.  And on that basis a decision will be taken as to when these talks will take place."
"EU citizens leaving UK pushes down net migration after Brexit vote LONDON (Reuters) - Net migration to Britain fell to its lowest level in three years in the 12 months to the end of March, with more than half the drop caused by European Union citizens leaving and fewer arriving since the Brexit vote.  The biggest drop in the figures came from eight eastern European countries, including Poland and Hungary, that joined the EU in 2004, leading to a migration to Britain of many eastern Europeans hoping for better-paid jobs.  Net migration, which shows the annual difference between those moving to and leaving the country, has been falling since Britain s June 2016 vote to exit the European Union.  According to the Office for National Statistics, it stood at 246,000 in the 12 months to the end of March, down 81,000 from the previous year and compared with the 336,000 record number that was published just before the Brexit referendum.  Within the 246,000, some 127,000 were from the EU, down 51,000 to its lowest level since the 12 months ending December 2013, as emigration rose and immigration fell compared to the previous 12 months. Business leaders said the drop in net migration was a serious concern for firms worried about wage inflation and an inability to fill skills gaps with British workers.  No one should celebrate these numbers,  Seamus Nevin, Head of Employment and Skills Policy at the Institute of Directors, said in a statement.   Given unemployment is currently at its lowest level ever (4.5 percent), without the 3 million EU citizens living here the UK would have an acute labor shortage. Signs that it is becoming a less attractive place to live and work are a concern.   According to an industry survey published on Thursday, nearly half of businesses operating in Britain s food supply chain say EU employees are thinking about leaving because of uncertainty around Brexit. Nearly a third said staff had already left [nL4N1L94S1]. The government has said it is still committed to an election promise to reduce the numbers to the  tens of thousands , first made in 2010 and designed to reassure Britons who were worried about the impact immigration had on public services.  Many Britons cited immigration as their reason for voting  Leave  in the referendum.     Britain has said it aims to guarantee the rights of EU citizens living in Britain and particularly important to sectors of the economy such as construction and the food and hospitality industries.  But Migration Watch UK, an advocacy group which has long called for immigration to be cut, said that while Thursday s figures were a positive sign, they remained too high.   This is a step forward but it is largely good fortune,  said Chairman Andrew Green.  This should not obscure the fact that migration remains at an unacceptable level of a quarter of a million a year with massive implications for the scale and nature of our society."
"Excessive force won't solve Myanmar's Rohingya crisis: Annan panel YANGON (Reuters) - Myanmar should respond to a crisis over its Muslim Rohingya community in a  calibrated  way without excessive force, a panel led by former U.N. chief Kofi Annan said on Thursday, adding that radicalization was a danger if problems were not addressed. The treatment of approximately 1.1 million Rohingya has emerged as majority Buddhist Myanmar s most contentious human rights issue as it makes a transition from decades of harsh military rule. Annan s commission - appointed last year by leader Aung San Suu Kyi to come up with long-term solutions for the violence-riven, ethnically and religiously divided Rakhine state - said perpetrators of rights abuses should be held accountable. Security deteriorated sharply in the western state on the border with Bangladesh last October when Rohingya militants killed nine policemen in attacks on border posts. In response, the Myanmar military sent troops fanning out into Rohingya villages in an offensive beset by allegations of arson, killings and rape by the security forces which sent 87,000 Rohingya fleeing to Bangladesh. The situation in the state deteriorated again this month when security forces began a new  clearance operation  with tension shifting to a township, Rathetaung, where Buddhist Rakhine and Rohingya communities live side-by-side.  While Myanmar has every right to defend its own territory, a highly militarized response is unlikely to bring peace to the area,  the nine-member commission said in its final report.  Whatever action is taken, we should make sure that the population do not suffer and (that) they have access to support and necessary humanitarian needs they require,  said Annan at a news conference in Yangon.  Annan added that he discussed the military operation in Rakhine s Mayu mountains with army chief Min Aung Hlaing, who told him that the risk of a negative impact on the civilian population was small due to the remoteness of the area. Nevertheless, the commission said that a nuanced and comprehensive response was needed to  ensure that violence does not escalate and inter-communal tensions are kept under control , it said. The commission warned that if human rights were not respected and  the population remain politically and economically marginalized   northern Rakhine State may provide fertile ground for radicalization, as local communities may become increasingly vulnerable to recruitment by extremists . The Rohingya are denied citizenship and classified as illegal immigrants from Bangladesh, despite claiming roots in the region that go back centuries, with communities marginalized and occasionally subjected to communal violence. Annan has visited Myanmar three times since his appointment, including two trips to Rakhine. On Thursday, he presented his findings to Suu Kyi and Min Aung Hlaing. The United Nations said in a report in February security forces had instigated a campaign that  very likely  amounted to crimes against humanity and possibly ethnic cleansing.  That led to the establishment of a U.N. fact-finding mission a month later. But Myanmar s domestic investigation team criticized the U.N. report this month and rejected allegations of abuses.  Myanmar declined to grant visas to experts appointed by the U.N. and instead the government said it would comply with recommendations by the Annan team. But Annan s panel - which has a broad mandate to look into, among other things, economic development, education and healthcare - said it was  not mandated to investigate specific cases of alleged human rights violations . It said that the government  should ensure   based on independent and impartial investigation   that perpetrators of serious human rights violations are held accountable . The commission made a host of other recommendations, ranging from a faster and more transparent citizenship verification process to equal access to healthcare."
"Britain to study effect of foreign students on economy LONDON (Reuters) - Britain commissioned a report on Thursday on the economic impact of foreign students, part of an increasingly heated debate over whether they should be included in the government s target of reducing migration to the tens of thousands. Prime Minister Theresa May has been under pressure to drop international students from Britain s immigration figures, which have remained stubbornly high despite her pledge as interior minister seven years ago to reduce them to under 100,000 a year. High rates of immigration into Britain were a major reason for the vote to leave the European Union last year. But many officials argue that foreign students contribute to the economy.  There is no limit to the number of genuine international students who can come to the UK to study, and the fact that we remain the second most popular global destination for those seeking higher education is something to be proud of,  interior minister Amber Rudd said in a statement.  We understand how important students from around the world are to our higher education sector, which is a key export for our country, and that s why we want to have a robust and independent evidence base of their value and the impact they have.  Immigration has long been a sensitive topic in Britain. The expansion of the European Union to take in some eastern European countries saw rates jump, which critics said put pressure on public services such as hospitals. But others argue that immigration helps the economy and a provides a much-needed workforce. By including students in the immigration figures, they say, Britain is failing to acknowledge the contribution they make or that most leave after finishing their studies. International students make up around a quarter of total immigration, according to official figures. Data released on Thursday showed that net migration to Britain in the year to March 2017 fell by 81,000 to 246,000 people. More than half of those who left were EU citizens . In a separate report on  What s happening with international student migration? , the Office for National Statistics said:    There is no evidence of a major issue of non-EU students overstaying their entitlement to stay.  Of the 1.34 million nationals from outside the European Economic Area who held visas that expired in 2016/17, 96.3 percent departed before the visa expired, the ONS said in another report. Another 0.4 percent departed after their visa had expired. Just 3.3 percent were not initially identified as having departed after their leave expired.  We have always been clear that our commitment to reducing net migration to sustainable levels does not detract from our determination to attract international students from around the world,  Immigration Minister Brandon Lewis said.  Since 2010 we have clamped down on abuse, while increasing the number of genuine students that come to the UK from around the world."
