 
"Venezuela ex-prosecutor says she has evidence of Maduro corruption BRASILIA/CARACAS (Reuters) - Dismissed Venezuelan prosecutor Luisa Ortega said on Wednesday she had evidence that President Nicolas Maduro was involved in corruption with construction company Odebrecht. Ortega, 59, was a key player in Venezuela s government but broke with it in March. She fled last week to Colombia by boat and on Wednesday morning landed in Brazil. Ortega said she had been persecuted in an effort to hide details of high-level corruption, saying she had proof, though she offered none. Ortega linked the Odebrecht scandal with Maduro and Socialist Party heavyweights including Diosdado Cabello and Jorge Rodriguez. Ortega said she had evidence that Cabello received some $100 million from the Brazilian company.  The international community must investigate such cases,  she told a news conference. Venezuelan authorities did not respond to a request for comment. Odebrecht admitted in a settlement with U.S. and Brazilian prosecutors to paying bribes across 12 countries to win contracts. According to a U.S. court ruling, between 2001 and 2016, Odebrecht paid about $788 million in bribes in countries including Brazil, Argentina, Colombia, Mexico and Venezuela. Ortega was removed from her position early this month by Venezuela s newly formed constituent assembly, a controversial pro-government body whose installation was called dictatorial by governments worldwide. Maduro said on Tuesday he would seek Ortega s arrest, accusing her of having worked for some time with the United States. Maduro blames Washington for many of Venezuela s problems, including triple-digit inflation, shortages of basic goods and months of anti-government unrest. In Caracas, state-controlled television broadcast images on Wednesday of a police operation in what it said was Ortega s apartment. The cameras showed marble floors, large paintings of Ortega herself and one by Andy Warhol, a cellar containing an array of expensive wines and a wardrobe filled with designer labels. Ortega said she would give details of the corruption cases to authorities in the United States, Spain, Mexico, Brazil and Colombia. Since settling in the United States, Brazil and Switzerland for a record $3.5 billion, Odebrecht has sought to negotiate leniency deals that would allow it to keep operating in other countries across Latin America."
"Netanyahu to Putin: Israel may act to curb Iran's clout in Syria SOCHI, Russia (Reuters) - Israeli Prime Minister Benjamin Netanyahu told Russian President Vladimir Putin on Wednesday that Israel was prepared to act unilaterally to prevent an expanded Iranian military presence in Syria. Russia intervened in the civil war on behalf of Syrian President Bashar al-Assad in 2015, joining a de facto alliance with Iranian forces, Lebanese Hezbollah and other Shi ite Muslim militias helping Damascus beat back Islamic State and other Sunni Muslim insurgent groups.  Israel fears an eventual Assad victory could leave Iran with a permanent garrison in Syria, extending a threat posed from neighboring Lebanon by the Iranian-backed Hezbollah. Meeting Putin in the Black Sea resort of Sochi, Netanyahu said Iran was fighting to cement an arc of influence from the Gulf to the Mediterranean.   Iran is already well on its way to controlling Iraq, Yemen and to a large extent is already in practice in control of Lebanon,  Netanyahu told Putin.  We cannot forget for a single minute that Iran threatens every day to annihilate Israel,  Netanyahu said.  Israel opposes Iran s continued entrenchment in Syria. We will be sure to defend ourselves with all means against this and any threat.  Putin, in the part of the meeting to which reporters had access, did not address Netanyahu s remarks about Iran s role in Syria nor his threat to take unilateral military action. But at the United Nations, Russian U.N. Ambassador Vassily Nebenzia told reporters the de-escalation zones established in Syria, of which Iran is guarantor alongside Turkey and Russia, are  real progress on the way to end that tragic war .  We know the position of Israel towards Iran but we think that Iran in Syria is playing a very constructive role,  said Nebenzia. Netanyahu advisers have privately said their focus is on keeping Iranian forces away from the Israeli-controlled Golan Heights, the Syrian side of which falls under a partial truce brokered by Russia and the United States in recent weeks.  In parallel to lobbying Moscow, Israel has been trying to persuade Washington that Iran and its guerrilla partners, not Islamic State, pose the greater common threat in the region.   Bringing Shi ites into the Sunni sphere will surely have many serious implications both in regard to refugees and to new terrorist acts,  Netanyahu told Israeli reporters after the three-hour meeting - his sixth with Putin since September 2015.  We want to prevent a war and that s why it s better to raise the alarm early in order to stop deterioration.  After the meeting, Netanyahu was due to fly back to Israel for talks with U.S. peace envoys Jared Kushner, Jason Greenblatt and Dina Powell, who are on a Middle East tour.    Russia has so far shown forbearance toward Israel, setting up a military hotline to prevent their warplanes or anti-aircraft units clashing accidentally over Syria. Israel s air force said last week it had struck suspected Hezbollah arms shipments around 100 times in Syria during the civil war, rarely drawing retaliation and apparently without Russian interference. Russian diplomats have argued that Moscow s stake in Syria deters Iran or Hezbollah from opening a new front with Israel.  We take the Israeli interests in Syria into account,  Alexander Petrovich Shein, Russia s ambassador to Israel, told its Channel One television on Tuesday.  Were it up to Russia, the foreign forces would not stay.   Zeev Elkin, an Israeli cabinet minister who joined Netanyahu in Sochi, said in a radio interview after the talks with Putin that he had  no doubt that it (the meeting) will lead to practical steps . Elkin did not elaborate."
"Former Libyan prime minister freed after abduction in Tripoli TRIPOLI (Reuters) - Former Libyan Prime Minister Ali Zeidan has been released after being abducted during a visit to the capital, Tripoli, and held for nine days by an armed group, a relative said on Wednesday. Zeidan was prime minister from 2012-2014, a period when Libya slid deeper into the political turmoil and armed conflict that has plagued the country since Muammar Gaddafi was overthrown six years ago.  He has since been living in Germany with his family. It is not clear why Zeidan traveled to Libya or why he was abducted. He was being held by a group aligned with the U.N.-backed government in Tripoli, though he faced no judicial charges, a source said. The U.N.-backed government has not commented on the case. Tripoli is controlled by a number of the armed groups that have held power in the capital since 2011. Some have been given semi-official status by successive governments, but the groups remain unaccountable and involved in criminal activity. A lawyer for Zeidan, Moussa Al-Doghali, told France 24 Arabic TV channel that his client was released without explanation and that he did not know the circumstances of his arrest and detention. Zeidan was in good health and was staying in a Tripoli hotel following his release, Doghali said.   In October 2013, Zeidan was briefly abducted from a Tripoli hotel room by an armed group allied to the parliament that sacked him just over a year later."
"Britain outlines plans to break free of European Court after Brexit LONDON (Reuters) - Britain on Wednesday outlined several escape routes from the  direct jurisdiction  of the European Court of Justice after Brexit, one of Prime Minister Theresa May s key aims in talks to unstitch 40 years of EU membership.     In a government paper on the highly-sensitive topic, Britain set out its determination to negotiate a tailor-made agreement to enforce its own laws and resolve disputes once it has left the bloc in March 2019.     The paper drew attention to several EU agreements which do not require the Luxembourg-based court s direct jurisdiction over other countries - a clear attempt to encourage more flexibility among EU officials who are protective of the court. May said breaking free of the ECJ s jurisdiction meant that Britain would be able to make its own laws and British judges and courts would enforce them.      We will take back control of our laws,  she told reporters  in southern England, in a denial of suggestions by opposition lawmakers that she had watered down her demands by qualifying her words to say  direct  jurisdiction and opening the way to  indirect influence .      Her words placated many pro-Brexit lawmakers in her Conservative Party who say the ECJ has slowly sucked power from Britain s courts and parliament. Leave Means Leave, a pro-Brexit campaigning group, said it welcomed the government s  overall commitment  but wanted to make sure  the ECJ no longer plays a part in the British legal system .       But May s stance could further harden the EU s stance on the court. Many European officials see the ECJ as the ultimate arbiter of EU law and have said it should continue to guarantee the rights of EU citizens living in Britain after Brexit and oversee the Brexit agreement.     In the paper, Britain says its court would guarantee the rights of EU citizens or businesses in the country:  Those rights and obligations will be enforced by the UK courts and ultimately by the UK Supreme Court.  The EU said it was sticking to its stance and hoped to make progress on three areas as a priority  - the rights of expatriates, Britain s border with EU state Ireland and a financial settlement. That distance in viewpoints could delay an agreement with the EU on the divorce, a partner from international law firm Bird & Bird said.   The government s arguments about the role of the ECJ will contribute to prolonged uncertainty for businesses in relation to Brexit,  said Richard Eccles. The ECJ issue has all but halted debate on guaranteeing the rights of expatriates, according to a joint status document, published last month that compared the EU and British positions. But the question of how to resolve disputes after Brexit could cause even more difficulties.  In its paper, the government suggested it was not asking for the impossible, zeroing in on examples of where the ECJ does not have direct jurisdiction in resolving disputes.     It said though such cases were  illustrative  to help discussions with the EU.     Earlier, Dominic Raab, a pro-Leave campaigner who is now minister for courts and justice, said Britain would most likely suggest Britain and the EU should appoint arbitrators and agree a third party to deal with contentious issues post-Brexit.    That s one possible alternative, but I think it s the most likely,  he told BBC Radio Four, adding that Britain would have to keep  half an eye  on the case law of the ECJ in the future. He, like May, denied that use of the word  direct  before jurisdiction meant the government had now accepted that the court would continue to have influence over British law. But opposition lawmakers said the paper was tantamount to admitting defeat by a government which lost its authority at an ill-judged election two months ago by watering down one of its  red lines .  Not much is left of (Brexit minister) David Davis s so-called  red line  of taking back control from European judges,  Andrew Adonis, a leading pro-EU campaigner, said.  This is a climbdown camouflaged in jingoistic rhetoric. Even if we leave the Single Market, European judges will still have considerable power over decisions made in the UK."
"Trump must be respected as U.S. president, says Germany's Merkel BERLIN (Reuters) - Chancellor Angela Merkel said on Wednesday Donald Trump must be shown appropriate respect for holding the office of the U.S. president, even if she may differ with him on policy issues. Merkel, campaigning for a fourth term in office after a Sept. 24 national election, has refused to bend to pressure from her Social Democrat (SPD) rivals to resist demands by Trump for NATO members to increase their defense spending. As a committed Atlanticist, she has stressed the strength of German relations with the United States even when flagging differences in opinion on policy.  If you take the president of the United States, whatever differences of opinion there may be, I know he prevailed in a tough election. It wasn t reserved for him on a silver platter,  she told business daily Handelsblatt in an interview.   In the end, he won the election under American electoral law and that means he is democratically elected and that this person should be shown the appropriate respect, regardless of how I assess his views,  she added. Her SPD challenger, Martin Schulz, has been far more critical of Trump, referring to the U.S. president as  this irresponsible man in the White House . Merkel, who enjoyed holidaying in the United States before becoming chancellor in 2005, said she missed the opportunity to vacation there now.  I can t go on holiday in San Diego now as chancellor because the time difference is too much, and that is something I miss a bit, but the work itself is so marvelous that I can afford to miss it."
"Pakistan rejects role of 'scapegoat for U.S. failures' in Afghanistan KARACHI, Pakistan (Reuters) - Pakistan has rejected U.S. criticism of its efforts to fight terrorism, saying it should not be made a scapegoat for the failure of the U.S. military to win the war in Afghanistan. U.S. President Donald Trump unveiled his policy for Afghanistan on Monday, stepping up the military campaign against Taliban insurgents and singling out Pakistan for harboring them. U.S. officials later warned that aid to Pakistan might be cut and Washington might downgrade nuclear-armed Pakistan s status as a major non-NATO ally, in order to pressure it to do more to help bring about an end to America s longest-running war. Pakistan s powerful military chief, General Qamar Javed Bajwa, met U.S. Ambassador David Hale on Wednesday and told him Pakistan was actively working for peace in Afghanistan.  We have done a lot ... and shall keep on doing our best, not to appease anyone but in line with our national interest and national policy,  Bajwa was quoted in an army press statement as telling Hale. Pakistani Foreign Minister Khawaja Asif added his voice to a chorus of indignation over the U.S. criticism, reiterating Pakistan s denial that it harbors militants.  They should not make Pakistan a scapegoat for their failures in Afghanistan,  Asif said in an interview with Geo TV late on Tuesday.  A group of influential Pakistani clerics including Sami-ul Haq, who runs a Islamic seminary where many senior Afghan Taliban studied, angrily condemned the United States.  America is the enemy of the Muslim ummah (community),  Haq told a press briefing along with other clerics who preach a jihadist doctrine.  The government of Pakistan should quit the alliance for war against so-called terrorism,  Haq added.  The heavens will not fall if America gets angry with us.  Pakistan has for years been battling homegrown Islamist militants who are seeking to overthrow the state with bomb attacks and assassinations. But critics say the Pakistani military nurtures other Islamist factions, including the Afghan Taliban, which are seen as useful to Pakistan s core confrontation with old rival India. Asif said Pakistan had suffered great losses from Islamist militancy - the government estimates there have been 70,000 casualties in militant attacks, including 17,000 Pakistanis killed - since Pakistan joined the U.S.  war on terrorism  after the Sept. 11, 2001, attacks on the United States. The relationship between the two countries has endured periods of extreme strain during the past decade, especially after al Qaeda leader Osama bin Laden was found and killed by U.S. special forces in Pakistan in a 2011 raid.   Last year, a U.S. drone strike killed then-Afghan Taliban leader Mullah Akhtar Mansour in southwestern Pakistan, an attack Islamabad protested as a violation of its sovereignty. Pakistan has denied knowledge that either bin Laden or Mansour were in the country."
"Romanian president opposes plans for judicial overhaul BUCHAREST (Reuters) - Romania s justice minister proposed a significant overhaul of the judicial system on Wednesday which the president called an attack on the rule of law that would set the country back a decade. Romania is seen as one of the EU s most corrupt states and Brussels keeps its justice system under special monitoring. Attempts by the ruling coalition of Social Democrats and junior partner ALDE to weaken a crackdown on high-level corruption triggered the country s largest street protests in decades at the start of the year. Justice Minister Tudorel Toader proposed a slew of changes on Wednesday ranging from the way chief prosecutors are appointed to setting up a special prosecuting unit for crimes committed by magistrates.  The proposals ... constitute an attack against the rule of law, the independence and proper functioning of the judiciary as well as the anti-corruption fight,  centrist President Klaus Iohannis said in a statement.  If this mix of measures is adopted by the government and approved by parliament, Romania s efforts for more than 10 years will be wiped out and the justice system will go back to a time when it was subordinated to politics.  Under Romanian law, the president appoints chief prosecutors who have been proposed by the justice minister and received non-binding approval from the Superior Magistrates  Council (CSM), the top watchdog that safeguards judicial independence.  Toader also proposed that the justice minister, who is politically appointed, take control of the judicial inspection unit from the CSM. Analysts and magistrates have said this would lead to political interference in the justice system. The Prosecutor General s office said these proposals were an alarm signal, adding that prosecutors had not been consulted. Toader declined to answer questions but told reporters the proposals were  within normal and necessary parameters for the rule of law.  The proposals will be send to the CSM for an opinion before being submitted to the government and ultimately parliament for approval."
"Iran, Saudi Arabia to exchange diplomatic visits: Iranian foreign minister BEIRUT (Reuters) - Iran and Saudi Arabia will exchange diplomatic visits soon, Tehran said on Wednesday, indicating a possible thaw in relations between the regional rivals since they severed diplomatic ties last year. Iranian Foreign Minister Mohammad Javad Zarif told the Iranian Students  News Agency (ISNA) that the visits could take place after the haj pilgrimage ends in the first week of September.  The visas have been issued for both sides to make this trip,  Zarif said, according to ISNA.  We are waiting for the final steps to be completed so diplomats from the two countries can inspect their embassies and consulates.  Relations between Iran and Saudi Arabia are at their worst in years, with each accusing the other of subverting regional security and supporting opposite sides in conflicts in Syria, Iraq and Yemen. Iranian protesters stormed the Saudi embassy in Tehran in Jan. 2016 after a prominent Saudi Shi ite cleric was executed, prompting Riyadh to close the embassy. Saudi Arabia and several other Arab governments have severed ties with Qatar, citing its support of Iran as one of the main reasons. Iran has blamed Saudi Arabia for being behind deadly twin attacks on June 7 in Tehran claimed by Islamic State. At least 18 people were killed and more than 40 wounded in the attacks, in which Riyadh has denied any involvement. Thousands of Iranian pilgrims are currently undertaking the haj pilgrimage in Saudi Arabia."
"Danish police identify torso as missing submarine journalist COPENHAGEN (Reuters) - Police on Wednesday identified a headless female torso washed ashore in Copenhagen as that of Swedish reporter Kim Wall, who they believe was killed by a Danish inventor on board his home-made submarine. Wall, who was researching a story on inventor Peter Madsen, went missing after he took her out to sea in his 17-metre (56-foot) submarine on Aug. 10. He denies killing her, saying she died in an accident. Announcing the results of tests on the torso, discovered by a passing cyclist on Monday, police spokesman Jens Moller said it had suffered damage suggesting  an attempt to make sure air and gas inside should leave the body so that it would not rise from the seabed . He added:  There was also some metal attached to the body, allegedly also to make sure the body would sink to the bottom.  The arms, legs and head had been sawn from the body. Analysis showed a match with Wall s DNA, which the police had gathered from a toothbrush and a hairbrush, and with blood found in the submarine, Moller said. Police still do not know the cause of death, and divers are searching for more body parts. Madsen, 46, is charged with manslaughter, which carries a sentence of between five years and life in prison. His lawyer  Betina Hald Engmark told Reuters he was maintaining his innocence and sticking to his account that Wall s death was accidental. The macabre case has riveted Swedish and Danish media, and made headlines around the world.  It is with boundless sadness and dismay we received the message that the remains of our daughter and sister Kim Wall have been found,  Wall s mother Ingrid Wall said on Facebook.  During the horrendous days that have passed since Kim disappeared, we have received countless evidence of how loved and appreciated she was, both as a person and friend and as a professional journalist. From all corners of the world comes proof of Kim as a person who made a difference.  Madsen has told a court that following the alleged accident, he  buried  Wall at sea - changing his initial statement to police that he dropped her off alive in Copenhagen. A day after taking Wall out on his UC3 Nautilus submarine, the inventor was rescued after the vessel sank. Police found nobody else on board. The submarine is one of three constructed by Madsen and one of the largest privately built ones in the world. It can carry eight people and weighs 40 tonnes when fully equipped.  Madsen was already well known in Denmark as an entrepreneur and aerospace engineer, as well as for his submarines. He founded the association Copenhagen Suborbitals, with the goal of sending a person into space in a home-built rocket, and wrote a blog under the nickname  Rocket Madsen .  He is not violent, he does not drink, does not do drugs,  Thomas Djursing, who wrote a book about him, told Danish tabloid B.T. earlier this month.  On the other hand, he quarrels with everyone and I have argued with him too. But that is how it often is with people who are deeply driven by a passion.  Wall, 30, was a freelance journalist whose work had appeared in Harper s Magazine, The Guardian, The New York Times, Foreign Policy, the South China Morning Post, The Atlantic and TIME.  Originally from Sweden, she held degrees from New York s Columbia University and the London School of Economics and was based between New York and Beijing. She had written about topics ranging from gender and social justice to pop culture and foreign policy, according to her LinkedIn profile. She had also received training in hostile environments and emergency first-aid, she said on the profile. Her mother said she had uncovered stories all over the world.  She gave a voice to the weak, the vulnerable and marginalized people. That voice would have been needed for a long, long time. Now it won t be so."
