 
"North Korea tests short-range missiles as South Korea, U.S. conduct drills SEOUL/WASHINGTON (Reuters) - North Korea fired several short-range missiles into the sea off its east coast early on Saturday, South Korea and the U.S. military said, as the two allies conducted annual joint military drills that the North denounces as preparation for war. The U.S. military s Pacific Command said it had detected three short-range ballistic missiles, fired over a 20 minute period.  One appeared to have blown up almost immediately while two flew about 250 km (155 miles) in a northeasterly direction, Pacific Command said, revising an earlier assessment that two of the missiles had failed in flight. The test came just days after senior U.S. officials praised North Korea and leader Kim Jong Un for showing restraint in not firing any missiles since late July.  The South Korean Office of the Joint Chiefs of Staff said the projectiles were launched from the North s eastern Kangwon province into the sea. Later on Saturday, the South Korean Presidential Blue House said the North may have fired an upgraded 300-mm caliber multiple rocket launcher but the military was still analyzing the precise details of the projectiles.  Pacific Command said the missiles did not pose a threat to the U.S. mainland or to the Pacific territory of Guam, which North Korea had threatened earlier this month to surround in a  sea of fire . Tensions had eased somewhat since a harsh exchange of words between Pyongyang and Washington after U.S. President Donald Trump had warned North Korean leader Kim Jong Un he would face  fire and fury  if he threatened the United States. North Korea s last missile test on July 28 was for an intercontinental ballistic missile designed to fly 10,000 km (6,200 miles). That would put parts of the U.S. mainland within reach and prompted heated exchanges that raised fears of a new conflict on the peninsula. Japan s Chief Cabinet Secretary Yoshihide Suga said the missiles did not reach its territory or exclusive economic zone and did not pose a threat to Japan s safety.  The South Korean and U.S. militaries are in the midst of the annual Ulchi Freedom Guardian drills involving computer simulations of a war to test readiness and run until Aug. 31. The region where the missiles were launched, Kittaeryong, is a known military test site frequently used by the North for short-range missile drills, said Kim Dong-yub, a military expert at the Institute for Far Eastern Studies in Seoul.   So rather than a newly developed missile, it looks to be short range missiles they fired as part of their summer exercise and also in response to the Ulchi Freedom Guardian drill,  he said. The United States and South Korea are technically still at war with the North because their 1950-53 conflict ended in a truce, not a peace treaty. The North routinely says it will never give up its weapons programs, saying they are necessary to counter perceived U.S. hostility. Washington has repeatedly urged China, North Korea s main ally and trading partner, to do more to rein in Pyongyang. China s commerce ministry late on Friday banned North Korean individuals and enterprises from doing new business in China, in line with United Nations Security Council sanctions passed earlier this month. The White House said Trump had been briefed about the latest missiles but did not immediately have further comment. The U.S. State Department did not immediately comment about the Saturday launches. Secretary of State Rex Tillerson earlier this week credited the North with showing restraint by not launching a missile since the July ICBM test. Tillerson had said he hoped that the lack of missile launches or other  provocative acts  by Pyongyang could mean a path could be opening for dialogue  sometime in the near future.   Trump also expressed optimism earlier this week about a possible improvement in relations.  I respect the fact that he is starting to respect us,  Trump said of Kim.         North Korea s state media reported on Saturday that Kim had guided a contest of amphibious landing and aerial strike by its army against targets modeled after South Korean islands near the sea border on the west coast. The official KCNA news agency quoted Kim as telling its Army that it  should think of mercilessly wiping out the enemy with arms only and occupying Seoul at one go and the southern half of Korea.  A new poster on a North Korean propaganda website on Saturday showed a missile dealing  a retaliatory strike of justice  against the U.S. mainland, threatening to  wipe out the United States, the source of evil, without a trace.    On Wednesday, Kim ordered the production of more rocket engines and missile warheads during a visit to a facility associated with North Korea s ballistic missile program.  Diagrams and what appeared to be missile parts shown in photographs published in the North s state media suggested Pyongyang was pressing ahead with building a longer-range ballistic missile that could potentially reach any part of the U.S. mainland including Washington. (For an interactive package on North Korea's missile capabilities click here)  (For a graphic on North Korea missile trajectories, ranges click tmsnrt.rs/2vLMdVm)"
"Saudi-led force admits strike in Yemen's capital hit civilians RIYADH (Reuters) - A Saudi-led Arab coalition on Saturday conceded that an air raid in Yemen s capital a day earlier had resulted in civilian casualties, blaming the incident on an unspecified  technical error . The early morning attack in the Faj Attan area of Sanaa hit a vacant building but caused an adjacent apartment block to collapse, killing at least 12 people, six of them children, residents have said. Coalition spokesman Colonel Turki al-Maliki defended the strike as having  a legitimate military target , which he said was a Houthi command and control center. He accused the fighters of using civilians as human shields.  A technical error was the reason for the unintentional accident and the house in question was not directly targeted,  he said a statement carried by Saudi state news agency SPA. Maliki said the coalition expressed remorse for  collateral damage to civilians  but did not specify the extent of casualties. However, a senior ICRC official visited the site of the strike on Friday and said,  From what we saw on the ground, there was no apparent military target.  Yemen s long war involving competing Yemeni factions and regional power struggles has killed at least 10,000 people. Millions more have been forced to leave their homes and face disease and hunger. The Houthis and their ally, former president Ali Abdullah Saleh, control much of the north of the country, including Sanaa. Yemen s internationally recognised government is backed by the Saudi-led military coalition and is based in the south. The United States and Britain provide arms and logistical assistance to the alliance for its campaign. The issue has caused controversy in Britain over the toll on civilians. As well as military targets, air strikes have hit hospitals and ports, exacerbating the humanitarian crisis."
"Italy's interior minister meets Libyan mayors over people smuggling MILAN (Reuters) - Italian Interior Minister Marco Minniti met Libyan mayors on Saturday to renew a commitment to fight people trafficking as part of an agreement signed earlier this year between Rome and Tripoli. The meeting, which Libya s interior minister also attended, focused on fostering alternatives to human smuggling and trade in contraband in Libyan towns heavily affected by illegal immigration.  Youngsters in those areas and the whole of Libya deserve a future of hope, free from the threats of criminal organisations...  both sides said in a statement issued by Italy s Interior Ministry. In February, Italy pledged money, training and equipment to help the U.N.-backed Libyan government curb the flow of migrants to Europe. More than 600,000 migrants have reached Italy by sea from North Africa since 2014, most of them from Libya where people smugglers have operated with impunity in the turmoil that followed the fall of Muammar Gaddafi in 2011. The subject of immigration is dominating Italy s political agenda ahead of general elections due before May next year, with public opinion increasingly hostile to migrants.  After a surge in migrant arrivals from Libya at the start of the year, numbers have recently slowed and Minniti said earlier this month those trends would continue in August. Saturday s meeting also included, among others, Italy s ambassador to Tripoli and representatives of the European Commission."
"After Yemeni air strike, little girl is family's only survivor SANAA (Reuters) - Her bruised eyes still swollen shut, Buthaina Muhammad Mansour, believed to be four or five, doesn t yet know that her parents, five siblings and uncle were killed when an air strike flattened their home in Yemen s capital. Despite concussion and skull fractures, doctors think Buthaina will pull through   her family s sole survivor of the Aug 25 attack on an apartment building that residents blame on a Saudi-led coalition fighting in Yemen since 2015. The alliance said in a statement it would investigate the air strike, which killed at least 12 civilians. Yemen s long war involving competing Yemeni factions and regional power struggles has killed at least 10,000 people. Millions more have been forced to leave their homes and face disease and hunger. Aid agencies have called for a speedy resolution to the conflict, warning that the impoverished country is now victim to the world s greatest man-made humanitarian disaster. Lying disoriented in her hospital bed on Saturday, Buthaina called out for her uncle, Mounir, who was among those killed in the attack. Another uncle, Saleh Muhammad Saad, told Reuters Mounir had rushed to the family s house when Buthaina s father called him at 2 a.m. to say war planes were bombing their neighborhood in Sanaa s Faj Attan district. He never returned. By the time Saleh got to the house, it was a ruin of broken concrete blocks and wooden planks. Hearing survivors groaning from beneath the rubble, he battled to free them.  I could hear the shouts of one of their neighbors from under the rubble, and tried to remove the rubble from on top of (Buthaina s father) and his wife, but I couldn t. They died,  he said.  We lifted the rubble and saw first her brother Ammar, who was three, and her four sisters, all of them dead. I paused a little and just screamed out from the pain. But I pulled myself together, got back there and then heard Buthaina calling.  He said her survival had given him some solace as he mourned the rest of the family.  Her sister Raghad always used to come up and hug me and kiss me when I visited. I used to say to her,  Come on, that s enough.  And she would say  Oh no it isn t!  and just keep hugging and kissing."
"Man with sword injures police outside UK Queen's palace (Reuters) - A man who assaulted police officers with a four-foot sword outside Queen Elizabeth s Buckingham Palace residence shouting  Allahu Akbar  (God is greatest) was being questioned by counter-terrorism police on Saturday. Two unarmed officers suffered slight cuts as they detained the man, who drove at a police van on Friday evening, then took the sword from the front passenger foot-well of his car, London s Metropolitan Police said.  It was too early to say what the man was planning to do, said Commander Dean Haydon, the head of the Met s Counter Terrorism Command.   We believe the man was acting alone and we are not looking for other suspects at this stage,  he said.  It is only right that we investigate this as a terrorist incident at this time.   Europe has been on high alert following a string of militant attacks, including four this year in Britain which killed 36 people. The country s threat level remains at severe, meaning an attack is highly likely. No members of the royal family were present in the palace, which is a magnet for tourists in Britain s capital in the peak August holiday weekend.  I want to thank the officers who acted quickly and bravely to protect the public last night demonstrating the dedication and professionalism of our police,  Prime Minister Theresa May said in a message on Twitter. The suspect was initially arrested on suspicion of grievous bodily harm and assault on police. He was then further arrested under Britain s Terrorism Act. Police said they were investigating a 26-year-old man from the Luton area, an ethnically diverse town 35 miles (55 km) north of London where police have carried out investigations linked to other militant attacks, including one earlier this year on London s Westminster Bridge.   My partner saw a sword (...) as well as a policeman with blood on him, looking like his hand or chest was injured. The police officer had it in his hand, walking away with it,  said an unnamed witness quoted by The Times newspaper, who said tourists were running away from the scene.  Something happened before, which is why the people ran away. I m not sure what this was. But people were already scared and I saw the policeman pull the man from the car  the witness said. The suspect was treated at a London hospital for minor injuries, and there were no other reported injuries.   This is a timely reminder that the threat from terrorism in the UK remains severe,  Haydon added.  The police, together with the security services, are doing everything we can to protect the public and we already have an enhanced policing plan over the Bank Holiday weekend to keep the public safe."
"Chinese government advisor says more Mandarin needed to fight poverty BEIJING (Reuters) - Not enough effort is being put into teaching China s ethnic minorities standardized Mandarin Chinese during Beijing s fight to eradicate poverty, a top advisor to the government said on Saturday. Chinese president Xi Jinping has declared war on poverty, and instructed local governments to eliminate impoverishment to create a  moderately well-off society  by the beginning of 2021, in time for centenary of the ruling Communist Party. While regional authorities have dolled out supportive policies, funds and programs in China s poorest regions, they are failing to teach ethnicities enough Mandarin, Zhu Weiqun, said in an article in the state-backed Global Times newspaper. Efforts to teach minority peoples Mandarin are  not up to scratch  in various places, said Zhu, who is head of the minorities and religions committee of the Chinese People s Political Consultative Conference, an advisory body.  I regularly come across low level cadres who with great effort use a mouthful of dialect to talk about their poverty alleviation plans without realizing that dealing with their own deficiencies in speaking Mandarin is an urgent task,  he said. China promotes the use of standardized Mandarin, based on the dialect of Beijing, and encourages ethnic minorities to learn the official language in a bid to improve unity in multi-ethnic areas of the country. But there has been resistance to the push for standardization in regions such as Tibet and Xinjiang, where Tibetans and Uighurs, a Turkic speaking mostly Muslim minority, often consider language integral to their cultural identity. Beijing denies that Mandarin promotion damages minority culture, arguing that learning the official language gives minorities greater opportunities for work and schooling. Zhu said in the article that communication issues with workers from Xinjiang could cause a  vicious cycle  when companies group the workers together hindering their ability to work with others. Over 70 percent of the population speaks Mandarin, but there levels of fluency in west China are 20 percent lower than in the east, with only 40 percent of people able to speak Mandarin in some rural areas, Zhu said.  Using standardized Mandarin to alleviate poverty, using poverty alleviation to promote standardized Mandarin, does not only have an economic importance, but also has a deep political importance,  he said."
"Thousands rally for gay marriage in Australia ahead of vote SYDNEY (Reuters) - Thousands of people rallied for marriage equality in Australia s second-biggest city of Melbourne on Saturday ahead of a postal survey on same-sex marriage which could lead to its legalisation. Australia is one of the only developed English-speaking countries not to have legalised same-sex marriage, despite strong popular support and the backing of a majority of lawmakers. Shadow Attorney-General Mark Dreyfus, of the opposition Labor Party, called on the conservative Liberal Party-led government to do more to ensure the debate did not turn ugly ahead of the postal survey next month.  I m particularly calling on the prime minister of Australia to speak out against any bile or hate speech that we might see in this campaign,  he told the rally. Prime Minister Malcolm Turnbull last week urged supporters and opponents of same-sex marriage to show mutual respect as their campaigns turned increasingly vitriolic. [nL4N1LB1TJ] Rally organiser Anthony Wallace from activist group Equal Love said 15,000 people attended the event, making it one of the largest gay rights rallies in Australian history. Police declined to estimate the size of the crowd. The rally is an annual event, which this year began and ended at the Victorian State Library, where a mass same-sex wedding ceremony was held.  Australians will vote over several weeks from mid-September in the non-compulsory postal ballot on whether to legalise same-sex marriage. Same-sex marriage is supported by 61 percent of Australians, a 2016 Gallup opinion poll showed, but the issue has fractured the Turnbull government and damaged his standing with voters, now at a six-month low."
"More than a thousand turn Philippine funeral to protest against war on drugs MANILA (Reuters) - More than a thousand people attended a funeral procession on Saturday for a Philippine teenager slain by police last week, turning the march into one of the biggest protests yet against President Rodrigo Duterte s deadly war on drugs. The death of Kian Loyd delos Santos has drawn widespread attention to allegations that police have been systematically executing suspected users and dealers - a charge the authorities deny. Nuns, priests and hundreds of children, chanting  justice for Kian, justice for all  joined the funeral cortege as it made its way from a church to the cemetery where the 17-year-old was buried. Delos Santos  father, Saldy, spoke briefly during a mass to defend his son s innocence and express anger over the police.  Don t they have a heart? I m not sure they do. There s a lot of churches, they should go there,  he said, his voice cracking with emotion. Delos Santos was dragged by plain-clothes policemen to a dark, trash-filled alley in northern Manila, before he was shot in the head and left next to a pigsty, according to witnesses whose accounts appeared to be backed up by CCTV footage. Police say they acted in self defense after delos Santos opened fire on them. The parents and lawyers of delos Santos filed a murder complaint against the three anti-narcotics policemen on Friday. If accepted, the complaint would follow at least two cases filed last year against police over Duterte s war on drugs, which has killed thousands of Filipinos, outraged human rights groups and alarmed Western governments.  Delos Santos  flower-draped coffin passed through a major highway on a small truck decorated with tarpaulins reading  Run, Kian, Run  and  Stop the killings  displayed on each side. Passing motorists honked in support.  This is a sign that the people have had enough and are indignant over the impunity that prevails today,  Renato Reyes, secretary general of left-wing activist group Bayan (Nation), said in a statement.  The people protest the utter lack of accountability in the police force.   Mourners, some of them wearing white shirts, held flowers and small flags, and placards denouncing the killing. A member of Rise Up, a Manila-based coalition of church-related groups opposing the drug war, told Reuters that families of about 20 victims joined the procession.  I came to support the family. I want justice for Kian and all victims - including my son,  said Katherine David, 35, whose 21-year-old son was shot dead by police with two other men in January.   Department of Justice personnel armed with assault rifles were on guard during the procession and outside the church.  Most people in the Philippines support the anti-drug campaign, and Duterte remains a popular leader but questions have begun to be asked since the death of delos Santos, which came during a spike in killings across the Philippines  main island, Luzon, last week. (Graphic: tmsnrt.rs/2ixnYFu)     The president s communication office reiterated on Saturday he will not tolerate wrongdoing by law enforcers and called on the public to  trust the justice system under the Duterte presidency.  But bereaved mother David believes the response to Kian s killing marks a turning point in opposition to the drug war.   There s been a big change. Before, police could kill and nobody paid attention. Now people are starting to show support and sympathy,  she said."
"U.S. Black Hawk helicopter crashes off Yemen, one service member missing WASHINGTON (Reuters) - A U.S. Black Hawk helicopter crashed off the coast of Yemen on Friday during a training mission and a search was under way for one U.S. service member, the U.S. military said. U.S. Central Command said in a statement that five other service members aboard the aircraft had been rescued after the crash, which took place about 20 miles (32 km) off the southern coast of Yemen at 7 p.m. (16000 GMT). A U.S. official told Reuters that the cause of the crash was under investigation.  When the incident took place the helicopter was not very high above the water,  CENTCOM spokesman Colonel John Thomas said.  The United States has been carrying out air strikes against al Qaeda in Yemen, with at least 80 launched since the end of February.  A small number of ground raids using U.S. Special Operations forces have also taken place, including one in January which resulted in the death of a U.S. Navy Seal. There have been a number of aviation mishaps involving U.S military aircraft in the past few months.  The U.S. Coast Guard recently said that it had suspended its search off Hawaii for five Army aviators missing since their Black Hawk helicopter crashed earlier this month. In April, a Black Hawk U.S. Army helicopter crashed on a Maryland golf course, killing one crewmember and seriously injuring two others. Last month, a military transport plane crash killing 16 service members including elite special operations forces in northern Mississippi."
"Prosecutors target Guatemala president over campaign financing GUATEMALA CITY (Reuters) - Guatemala s attorney general and a U.N-backed anti-graft body on Friday said they are seeking to investigate President Jimmy Morales over suspected illicit campaign financing. Ivan Velasquez, head of the International Commission Against Impunity in Guatemala (CICIG), told reporters there was evidence that Morales broke the law when he was head of the conservative National Convergence Front (FCN), and that prosecutors had filed a motion to investigate him.  In order to advance the investigation, it s necessary to remove his immunity,  said Velasquez, who on Thursday unveiled a probe into all political parties over suspected wrongdoing related to financing for the 2015 election campaign. To remove Morales  immunity, prosecutors need the go-ahead from both the Supreme Court and a two-thirds majority in Congress. He could then be formally investigated and charged. In a statement, the president s office said,  The President of the Republic has been and is respectful of the law and due process, and thus is confident in the objectivity of justice.   Morales took office in 2016, winning the election on an anti-corruption ticket after the CICIG helped to bring down his predecessor over a multi-million-dollar corruption scandal. Earlier this week, two government officials told Reuters that Morales would ask U.N. Secretary-General Antonio Guterres to replace Velasquez, who is already investigating a graft case that involves the president s elder brother and one of his sons.  He better have some really valid reasons ... to seek my removal from the post,  said Velasquez, adding he would not resign. Morales met with Guterres in New York on Friday. The secretary-general reiterated his backing for Velasquez and the CICIG s work at the meeting, with Guterres citing  the Organisation s continuing support to the mandate of the International Commission Against Impunity in Guatemala,  the United Nations said in a statement. The president s office, in its statement, said it was worried about  manipulation  of information about the visit. The statement said Morales told Guterres it was important the CICIG stick to its original mandate.  Guatemala s foreign minister, Carlos Morales, who is not related to the president, told Reuters that there had been no request made on Friday to remove Velasquez from office. In 2015, the CICIG was instrumental in removing former President Otto Perez from office after identifying him as a key player in an alleged multi-million-dollar corruption racket. Perez is now in prison on trial with his former vice president."
