 
"Britain will not pay 'a penny more' than it thinks right to leave EU: Boris Johnson LONDON (Reuters) - Britain will pay  not a penny more, not a penny less  than what the government thinks its legal obligations are to the European Union as the country leaves the bloc, foreign minister Boris Johnson said on Friday. Talking to BBC Radio Four, Johnson said his comment that the EU could  go whistle  on its demands for payment was in response to being asked whether Britain would pay  100 billion euros or pounds , and not a suggestion that the government would not pay. A financial settlement is set to be one of the most difficult issues to resolve in negotiations to unravel more than 40 years of union, and the EU has said it is one of three areas the two sides must make progress on before starting talks on a future relationship, including trading arrangements.  Some of the sums that I ve seen seem to be very high. Of course, we will meet our obligations,  Johnson said.  We should pay not a penny more, not a penny less of what we think our legal obligations amount to."
"Brexit bill gets bigger as euro strengthens LONDON (Reuters) - As Britain s pound declines against the euro, talk has begun to circulate about the potential for parity. Less noted, however, is the fact that the more the pound weakens and euro strengthens the more the eventual leaving bill Britain will pay the European Union may cost. The bill in pounds, if it came today, would have risen nearly 17 percent since the vote to leave the EU in June 2016   1.4 percent since mid-August alone. Britain and the EU return to the negotiating table on Monday with the leaving bill high on the agenda. A net 60 billion euros ($70.8 billion) has been floated in Brussels. It has been shot down by British officials. Were it to be correct, however, Britain would now owe around  9.4 billion pounds ($12 billion) more than it would have at the time of the vote. For a graphic on the Brexit bill, click: reut.rs/2iw4pNQ"
"Morocco's 'mule' women scratch a living on Spanish enclave border MELILLA, Spain (Reuters) - In a winding early-morning queue, Jemaa Laalaoua hunches over with 50 kg (110 lb) of kitchenware on her back, waiting to cross back into Morocco from the Spanish enclave of Melilla. The 41-year-old mother of eight is one of thousands of Moroccans who eke out a living by walking loads of merchandise from Melilla into the northern Moroccan province of Nador. Goods including metal kettles that Laalaoua was carrying are counted as personal luggage and are not taxed, allowing for a small mark-up when they are shipped on and sold on across Morocco.  On average, I earn about 70 dirhams ($7.40) per trip, carrying anywhere between 40 to 70 kg,  says Laalaoua.  But most days, we never know how much we will make.  The work is backbreaking and fraught with risk. Some traders have died in stampedes through the tight border crossing.  We say our prayers in the morning and brace for the day, not knowing if we will come out dead or alive,  Laalaoua says.  She lifts undergarments to display bruises on her leg from a Spanish Civil Guard s truncheon. She says she was beaten for attempting to advance towards the front of the queue. No one from the Civil Guard in Melilla was available to comment. When Laalaoua finally gets through the narrowly caged border crossing, she weaves through the crowd to drop off her cargo inside the bustling Beni Ansar market, before rushing back to a Melilla warehouse where she will load up for her last trip of the day.  Locals with an address in the Nador province are allowed to cross through into Melilla without a visa, but cannot spend more than a day in the Spanish enclave. They can cross for five hours a day, four days a week. In total, there are between 30,000-40,000 crossings daily, according to the Spanish border police.  The practice has been going on for decades. Before, it was dominated by single mothers known locally as  mule women , who struggled to make a living elsewhere.  But as unemployment has climbed, the women have increasingly found themselves in competition with young men. Each morning the women report to a boss who tasks them with transporting an assigned quantity of goods, coordinating with warehouse owners and shippers. By 5 a.m. crowds of hundreds swell to thousands, as people wait for Spanish guards to open the border gates. Male traders fight and women shout and scream as the jostle for a place in the crush. Most manage to make two or three crossings before the border shuts again.  The merchandise spans everything from simple household goods such as towels, toilet paper, and soap, to illicit wares including alcohol and plastic bags, which have been banned in Morocco since last year. Laalaoua lives nearly 27 km (17 miles) from the border, waking up at 2 a.m. to prepare for her commute, by foot then taxi or bus.  Her husband Mohammed Zoubah, 57, fell ill six years ago, forcing Laalaoua to become the primary breadwinner.  She s strong, she s protecting this household,  he says. May God bless her with patience."
"In their best red stilettos, German transvestites stomp on AfD BERLIN (Reuters) - German drag queens are using satire to spoof a hard-right party s anti-Islam election campaign, and German voters are loving it. They have formed Transvestites for Germany, or TfD, a name that bears an uncanny resemblance to Alternative for Germany (AfD), the name of Germany s leading right-wing party, and launched a Facebook campaign that has almost 7,000 followers. The AfD s election campaign focuses on messages that Islamic customs don t belong in Germany. That has left a bad taste with many Germans, and TfD saw an opportunity to use drag fashion and wit to mock the AfD s own election placards. The AfD posters feature white German women in bikinis or raising wine glasses, with captions like  Burka? I m into bikinis  and  Burka? I m into Burgundy . The posters are emblazoned with the party s election motto:  I dare you, Germany!  The TfD version of the posters uses the AfD s light blue party color but replaces the anti-immigrant party s red arrow with red stiletto shoes.  Guzzle your crap Burgundy alone! I prefer prosecco,  reads one poster with a picture of Gisela Sommer, one of several bearded men dressed like women and raising a middle finger on TfD placards, which include the hashtags #NoAfD and #NoNaziPack. JACKY-OH WEINHAUS The TfD campaign has drawn the attention of several German newspapers and has brought some flare to an otherwise largely dull election. Chancellor Angela Merkel is expected to win and secure a fourth term in office without much trouble.  I don t think that all AfD members are Nazis, but there is an appalling racial tone in this party which is for sure shared by many of its members,  said TfD leader Jacky-Oh Weinhaus.  Buffalo Meus, the media manager of the fictional party, said he gets about 50 Facebook messages a day from people asking how they can become TfD members.  We just wanted an art project,  Meus said.  But some people have taken us for a real party. They ask us,  how can I register?  How can I vote for you?    Not all the messages are pleasant. Other readers have wished the group members death by stoning or by hanging. The group s main goal is get the 17 million Germans who stayed home in the 2013 election to the polls. They hope their votes will cut into support for the AfD, which is forecast to enter parliament for the first time with 8 to 10 percent of the vote.  Instead of supporting the AfD, the only party that criticizes Islam, you go against it,  an angry Facebook user called Hans Horn wrote to TfD this week.  If Islamisation continues and Muslim invaders from Africa continue to flood in you will be the first to be thrown from high roofs.  The TfD responded two days later:  We love you and wish you a sunny Wednesday!"
"Samsung leader Jay Y. Lee given five-year jail sentence for bribery SEOUL (Reuters) - The billionaire head of South Korea s Samsung Group, Jay Y. Lee, was sentenced to five years in jail for bribery on Friday in a watershed for the country s decades-long economic order dominated by powerful, family-run conglomerates. After a six-month trial over a scandal that brought down the then president, Park Geun-hye, a court ruled that Lee had paid bribes in anticipation of favours from Park. The court also found Lee guilty of hiding assets abroad, embezzlement and perjury. Lee, the 49-year-old heir to one of the world s biggest corporate empires, has been held since February on charges that he bribed Park to help secure control of a conglomerate that owns Samsung Electronics, the world s leading smartphone and chip maker, and has interests ranging from drugs and home appliances to insurance and hotels.  Lee, who emerged stony-faced from the Seoul courtroom in a dark suit, but without a tie, and holding a document envelope, was escorted by justice ministry officials back to his detention centre.   This case is a matter of Lee Jae-yong and Samsung Group executives, who had been steadily preparing for Lee s succession ... bribing the president,  Seoul Central District Court Judge Kim Jin-dong said, using Lee s Korean name. Kim said that as the group s heir apparent, Lee  stood to benefit the most  from any political favours for Samsung. Lee denied wrongdoing, and one of his lawyers, Song Wu-cheol, said he would appeal.  The entire guilty verdict is unacceptable,  Song said, adding he was confident his client s innocence would be affirmed by a higher court. The case is expected to be appealed all the way up to the Supreme Court, likely next year.   The five year-sentence - one of the longest given to a South Korean business leader - is a landmark for South Korea, where the family-run conglomerates - or chaebols - have long been revered for helping transform the once war-ravaged country into a global economic powerhouse. But they have more recently been criticized for holding back the economy and stifling small businesses and start-ups. Samsung, a symbol of the country s rise from poverty following the 1950-53 Korean War, has come to epitomize the cosy and sometimes corrupt ties between politicians and the chaebols.  The ruling is a turning point for chaebols,  said Chang Sea-jin, a business professor at Korea Advanced Institute of Science and Technology.  In the past, chaebols weren t afraid of laws because they were lenient. Now, Lee s ruling sets a precedent for strict enforcement of laws, and chaebols should be wary.  Under South Korean law, sentences of more than three years cannot be suspended. The third-generation de facto head of the powerful Samsung Group, Lee has effectively directed operations since his father, Lee Kun-hee, was incapacitated by a heart attack in 2014.    Some investors worry a prolonged leadership vacuum could slow decision-making at the group, which has more than five dozen affiliate companies and assets of 363.2 trillion won ($322.13 billion). Its listed companies make up about 30 percent of the market value of South Korea s KOSPI stock index. Many tycoons, including Lee s father, were convicted of crimes in the past, ranging from bribery, embezzlement and tax evasion, only to get presidential pardons, as both the government and the public feared going too hard on them would hurt the economy. But South Korea s new liberal president, Moon Jae-in, who won a May election, has pledged to rein in the chaebols, empower minority shareholders and end the practice of pardoning tycoons convicted of white-collar crime. The presidential Blue House said in a statement that it hopes the ruling will serve as an opportunity to  end the nexus of business and politics that has held back the country.  In a June interview with Reuters, Moon said he did not believe Samsung s operations depended just on Lee.   When Lee was taken into custody, the share prices of Samsung went up,  Moon said.  If we were to succeed in reforming the running of the chaebols and also increasing transparency, I believe this will not only help the economic power of Korea but also help to make the chaebols themselves more competitive.  Investors say shares in chaebol companies trade at lower prices than they would otherwise because of their opaque corporate governance - the so-called Korea Discount. Shares of Samsung Electronics dropped more than 1 percent, and other group companies, including Samsung C&T and Samsung SDS, also turned lower after the verdict. The court said Samsung s financial support of entities backed by a friend of Park s, Choi Soon-sil, constituted bribery, including 7.2 billion won ($6.4 million) in sponsoring the equestrian career of Choi s daughter. In return, prosecutors say, Samsung sought government support for the 2015 merger of two of its affiliates, which helped Lee tighten control of the conglomerate. His lawyers had argued that the merger was done for business reasons. Some criminal lawyers had expected Lee to be found innocent of the major charges, as much of the evidence at the trial has been circumstantial. The appeals court and the Supreme Court might put a greater emphasis on prosecutors to provide direct proof of quid pro quo, the lawyers said. Park, who was forced from office in March, faces her own corruption trial, with a ruling expected later this year. Prosecutors have argued that Park and Lee took part in the same act of bribery - so Lee s conviction would appear ominous  for the former president.  Hundreds of Park s diehard supporters who rallied outside the court on Friday reacted with outrage to the ruling.  Our ultimate goal is Park s acquittal and release,  Kim Won-joon, a 62-year-old former construction worker said.  We worry how today s guilty verdict for Lee would affect Park s ruling.  Such supporters are a minority compared with the huge crowds that turned out in Seoul every week to call for Park s ouster after the bribery scandal surfaced late last year. Public approval of Lee s prosecution may underscore growing frustration in Asia s fourth-largest economy that the wealth amassed by conglomerates has not trickled down.  I think it was difficult for a court to ignore public opinion, given that the scandal rocked the country,  said Chung Sun-sup, chief executive of research firm Chaebul.com.  The five-year sentence was low given that he was found guilty of all the charges. I think the court gave him a lighter sentence, taking into account Samsung s importance to the economy."
"Thailand's ousted PM Yingluck has fled abroad: sources BANGKOK (Reuters) - Ousted Thai prime minister Yingluck Shinawatra has fled the country ahead of a verdict against her in a negligence trial brought by the junta that overthrew her, sources close to the Shinawatra family said on Friday. Yingluck, 50, whose family has dominated Thai politics for more than 15 years, failed to show up at court for judgment in a case centered on the multi-billion dollar losses incurred by a rice subsidy scheme for farmers. Overthrown in 2014, Yingluck had faced up to 10 years in prison if found guilty. Her former commerce minister was jailed in a related case for 42 years on Friday.  She has definitely left Thailand,  said one source, who is also a member of her Puea Thai Party. The sources did not say where she had gone. Yingluck s brother, Thaksin Shinawatra, who heads the political clan, was overthrown in a 2006 coup and fled into exile to escape a corruption conviction that he said was aimed at demolishing the populist movement he founded. The struggle between that movement and a Bangkok-centered royalist and pro-military elite has been at the heart of years of turmoil in Thailand. The verdict against Yingluck could have reignited tension, though the army has largely snuffed out open opposition. After Yingluck failed to show up, the Supreme Court issued an arrest warrant against her and rescheduled the verdict to Sept. 27. It said it did not believe her excuse that she could not attend the court hearing because of an ear problem.  It is possible that she has fled already,  Deputy Prime Minister Prawit Wongsuwan told reporters. He later said police were investigating reports that she had left via Koh Chang, an island close to the Cambodian border. Cambodian immigration police said she had not entered their country. Yingluck last commented on social media on Thursday, saying on her Facebook page that she would not be able to meet supporters at court because of tight security. She had been banned from traveling abroad at the beginning of the trial in 2015 and has attended previous hearings. The court confiscated the 30 million baht ($900,000) that Yingluck had posted as bail. Hundreds of her supporters had gathered outside the court on Friday where about 4,000 police had been deployed. Some held roses while others wore white gloves with the word  love  on them. Although Yingluck had already been banned from politics by the junta in 2015, she could have been a party figurehead for elections that junta leader Prime Minister Prayuth Chan-ocha has promised for next year. If Yingluck has fled it would disappoint her supporters and make her opponents feel vindicated, said Thitinan Pongsudhirak, director of the Institute of Security and International Studies at Chulalongkorn University.  It does not help with Thailand s division and polarization,  he said. Under the rice subsidy program, Yingluck s administration paid rice farmers up to 50 percent more than market prices. It left Thailand with huge rice stockpiles and caused $8 billion in losses. Yingluck has said she was only in charge of coming up with the policy but not the day-to-day management of it.  If she has fled people would not trust her, but the masses would still support her because they benefited from her policies,  38-year-old delivery man Sakunchai Muenlamai. The Supreme Court sentenced Yingluck s former commerce minister, Boonsong Teriyapirom, to 42 years in jail after finding him guilty of falsifying government-to-government rice deals between Thailand and China in 2013. He said he would appeal, but was told it was too late in the day to apply for bail so will spend the weekend behind bars."
"Illegal miners in South Africa swallow gold in condoms CAPE TOWN (Reuters) - Illegal miners in South Africa are swallowing unrefined gold and platinum in condoms as a new tactic to avoid arrest for smuggling that is costing the industry $1.5 billion a year, the police told parliament on Friday. Illegal mining has plagued South Africa s mining sector for decades, and extends from small time pilfering to global organized crime networks.  The crime costs the industry and government an estimated 20 billion rand ($1.5 billion) a year in lost sales, taxes and royalties, the Chamber of Mines, an industry body, says.  They are ingesting the amalgam concealed in condoms and this is done for two principle reasons. One is to be able to bypass mine security and the other is also to prevent being robbed by opposing groups,  Brigadier Ebrahim Kadwa, a commander in South Africa s Hawks organized crime unit, said, showing parliament slides of gold-filled condoms in miners  x-rays. Potentially toxic clumps of mercury and gold concentrate  can be refined to extract gold once passed through the body. Illegal mining in South Africa involves a complex criminal web that extends from desperate unemployed workers, many from neighboring countries, to gun-toting gang bosses and front companies exporting refined products to global markets.  The threat posed by illicit mining and related crimes continues to proliferate across the country,  Kadwa said, adding that the majority of incidents were in gold mines owned by Harmony Gold and Sibanye. However, hundreds of incidents occurred throughout the country and targeted other minerals such as diamonds and chrome. High rates of unemployment and a stagnant economy helped entice illegal miners to the dangerous work, which is also being driven by rising commodity prices.  Kadwa said a weakening of the rand currency between December 2015 to April 2016, saw the relative gold price rise, encouraging illegal smuggling. In February, 22 illegal miners were given lengthy sentences after being found guilty of 577 charges, ranging from theft of gold to racketeering and money laundering.  This is a landmark moment in the fight against illegal mining in the country,  Kadwa said."
"Downfall of ex-Samsung strategy chief leaves 'salarymen' disillusioned SEOUL (Reuters) - Over four decades, Choi Gee-sung, the fourth son of a poor civil servant, worked his way to the top of South Korea s Samsung Group, one of the world s leading business empires, inspiring a legion of salaried workers. On Friday, a Seoul court sentenced Choi to four years in jail for his part in a corruption scandal that toppled the country s president, and handed his billionaire boss, Jay Y. Lee, a five-year jail sentence. Song Wu-cheol, lead defense attorney for Choi, Lee and others, said they would appeal the convictions. Choi s downfall has fueled a sense of disillusionment at a time when the country s biggest conglomerate looks to its army of loyal  Samsung men  to navigate a potential leadership vacuum.  Choi was Lee s mentor and headed up Samsung s Corporate Strategy Office - dubbed the  control tower  - for more than four years before it was disbanded earlier this year after it came under fire for its role in the graft scandal. The office, which oversaw the Samsung group, orchestrating the big decisions on asset sales or arranging support for weakened group affiliates, was closed in February, and Choi stepped down. The Samsung scandal is the latest in a series to mire South Korea s so-called chaebols - the powerful, family-run conglomerates that dominate Asia s fourth-largest economy - which are criticized for their often cozy ties to politicians. The involvement of Choi - who rose as high in a conglomerate as possible for someone from outside the powerful chaebol families - has shocked many Samsung employees who admired his business acumen and work ethic that helped Samsung become a global technology powerhouse.  Choi has been portrayed as a poster child of a successful businessman ... I am dejected and angered by this scandal,  said one Samsung employee who declined to be identified. A Samsung company official said:  It s hard to do a job like that without loyalty. If the previous generation s frame of thinking was loyalty, that s got to change going forward.  Known for his tenacity, attention to detail, and focused drive, Choi took credit for helping Samsung Electronics, the group s crown jewel, overtake Nokia and Apple Inc in mobiles and Sony Corp in television manufacturing. It is also the world s leading chipmaker.  I played a part in today s Samsung standing tall as the No. 1 in semiconductors. We surpassed (mobile firm) Nokia when everyone thought it couldn t be done,  Choi recalled during his trial testimony, as Lee and other charged Samsung executives sat alongside.  The day media reported Samsung surpassed Intel as the No. 1 in semiconductors was the 40th anniversary of my first day at Samsung. It was also the day when the court hearing continued until 2 a.m.,  he said, referring to late July when Samsung reported record earnings on strong chip sales.  I was overwhelmed with feelings of regret, reflection and sadness.   Born into a poor family during the Korean War in 1951, Choi joined Samsung in 1977 to  put food on the table  after studying at the prestigious Seoul National University. Having worked in all Samsung s main businesses - from chips and mobile to display screens - Choi was among the few to rise to the top without an engineering background. He became CEO of Samsung Electronics in 2010.  Some people like me think that the higher up you go, the harder you have to work and the more unjust things you have to deal with,  said a 33-year-old Samsung employee, who declined to be identified.  I think he (Choi) may have agonized, though it was his choice to take the job.  As head of the  control tower , Choi said he accepted greater responsibility than Lee, and the decisions he made over matters related to the scandal were inevitable to  protect  Samsung from political pressure. The chaebols dominate the local economy, providing millions of jobs and defining many people s identity in South Korean society. Salaried workers are expected to serve them with long hours and unquestionable loyalty. That culture puts top executives under pressure to take the blame for their boss, experts say.  It s like Japan s samurai, who sacrifice their lives for the sake of their masters,  said Chung Sun-sup, head of Chaebul.com, a corporate analysis firm.  It s very regrettable, but that s the reality of what s expected from professional managers.  It s a path Choi felt he had little option but to take.  If you were to hold Samsung responsible, please blame me. I am aging and lost judgment ... Others just trusted me and followed my judgment,  he told the court during the trial."
